{
  "manifest_version": 1,
  "capsule_id": "ayni.model.router",
  "version": "1.0.0",
  "kind": "model",
  "owner": "platform/core",
  "tenant_scope": "deployment",
  "readiness": "lazy",
  "capabilities": ["model.generation"],
  "required_capabilities": ["platform.model_authority"],
  "provided_ports": [{ "port_id": "model.generate", "contract_version": "1.0.0", "effect_classes": ["none"] }],
  "required_ports": [
    { "port_id": "platform.model.authority", "accepted_versions": ["1.0.0"] }
  ],
  "required_capsules": [
    { "capsule_id": "ayni.core", "accepted_versions": ["1.0.0"] }
  ],
  "configuration_schema": { "type": "object", "properties": {}, "additionalProperties": false },
  "permissions": ["model.generate"],
  "required_permissions": ["model.generate"]
}
