{
  "manifest_version": 1,
  "capsule_id": "ayni.knowledge.memory",
  "version": "1.2.0",
  "kind": "knowledge",
  "owner": "platform/core",
  "tenant_scope": "tenant",
  "readiness": "dependency",
  "capabilities": ["knowledge.retrieval", "memory.proposal", "memory.review"],
  "required_capabilities": ["platform.run_evidence", "platform.tenant_scope"],
  "provided_ports": [
    { "port_id": "knowledge.retrieve", "contract_version": "1.0.0", "effect_classes": ["read"] },
    { "port_id": "knowledge.ingest", "contract_version": "1.0.0", "effect_classes": ["none"] },
    { "port_id": "memory.retrieve", "contract_version": "1.0.0", "effect_classes": ["read"] },
    { "port_id": "memory.propose", "contract_version": "1.0.0", "effect_classes": ["none"] },
    { "port_id": "memory.review", "contract_version": "1.0.0", "effect_classes": ["none"] }
  ],
  "port_permissions": {
    "knowledge.retrieve": ["knowledge.read"],
    "knowledge.ingest": ["knowledge.write"],
    "memory.retrieve": ["knowledge.read"],
    "memory.propose": ["memory.propose"],
    "memory.review": ["memory.review"]
  },
  "required_ports": [
    { "port_id": "platform.run.evidence", "accepted_versions": ["1.0.0"] },
    { "port_id": "platform.tenant.scope", "accepted_versions": ["1.0.0"] }
  ],
  "required_capsules": [
    { "capsule_id": "ayni.core", "accepted_versions": ["1.0.0"] }
  ],
  "configuration_schema": { "type": "object", "properties": {}, "additionalProperties": false },
  "permissions": ["knowledge.read", "knowledge.write", "memory.propose", "memory.review"],
  "required_permissions": ["knowledge.read", "memory.review"]
}
